{"budget":{"max_file_bytes":1048576,"max_files":2000,"max_total_bytes":16777216,"seconds":120},"contract":"devostasis.code-policy.v2","exclude":[".venv","build","dist","vendor","node_modules"],"grammar":"PYTHON_3_12","history":{"days":28,"enabled":true,"max_ancestors":2000,"max_blob_bytes":4194304,"max_commits":500,"max_diff_lines":100000,"max_diff_work":2000000,"max_objects":10000,"max_proof_bytes":33554432},"include":[],"limits":{"complexity":1,"file_lines":600,"function_lines":80},"source_roots":[".","src"],"version":"default-2"}